{
  "activation_authority": "MISSION_SCOPED",
  "adapter_mode": "DRAFT_PR_ONLY",
  "authority_id": "GATE7F-EXAMPLE-DELETE-AUTHORITY",
  "base_sha": "cbf765a5fdfeb325e096932d10978a3644819ce1",
  "branch": "source/gate-7f-example-delete",
  "build_identity": "GATE7F-EXAMPLE-BUILD",
  "candidate_tree_sha256": "e3b0c44298fc1c149afbf4c8996fb92427ae41e4649b934ca495991b7852b855",
  "commit_message": "prime: example mission-scoped production adapter delete mission",
  "declared_paths": [
    "example/delete.txt"
  ],
  "delete_authority_id": "GATE7F-EXAMPLE-DELETE-AUTHORITY",
  "execute_identity": "GATE7F-EXAMPLE-EXECUTE",
  "final_pathset_sha256": "0000000000000000000000000000000000000000000000000000000000000000",
  "implementation_state": "THREAD_ENGINE_ACTIVE_MISSION_SCOPED",
  "mission_id": "GATE7F-EXAMPLE-DELETE",
  "mission_sha256": "f100fa8afd45e109dea82196d0e6a6119a8ed3c034b10c1e03e87b546bc08401",
  "network_allowlist": [
    "https://github.com/Jktomy/atlas-prime.git",
    "https://api.github.com/repos/Jktomy/atlas-prime"
  ],
  "operations": [
    {
      "delete_authority_id": "GATE7F-EXAMPLE-DELETE-AUTHORITY",
      "operation": "DELETE",
      "path": "example/delete.txt",
      "source_sha256": "0000000000000000000000000000000000000000000000000000000000000000",
      "thread_id": "delete-example"
    }
  ],
  "payload_root": "production_adapter/examples",
  "persistent_writer": "ABSENT",
  "pr_body": "Mission-scoped production-adapter delete example mission only.",
  "pr_title": "prime: example mission-scoped production adapter delete mission",
  "receipt_name": "gate-7f-production-adapter-delete-example-receipt.json",
  "remote_url": "https://github.com/Jktomy/atlas-prime.git",
  "repository": "Jktomy/atlas-prime",
  "schema_version": "atlas-thread-engine-production-mission-v1",
  "source_blobs": {},
  "stop_point": "DRAFT_PR_READBACK"
}
